URL,Title,Rating,Reviews,Original Price,Price,Price/Oz,SNAP Eligible
https://www.amazon.com/s?k=Life+Cuisine&i=grocery&bbn=10329849011,"Sweet Earth General Tso's Tofu Frozen Bowl, 9 Oz",4.2,"1,234",,$4.99,$0.55,Yes
https://www.amazon.com/s?k=Life+Cuisine&i=grocery&bbn=10329849011,"Amy's Frozen Meals, Pad Thai, Made with Organic Rice Noodles, Broccoli and Carrots, Vegan & Gluten Free, 9.5 oz",4.3,"4,046",$6.49,$5.99,$0.63,Yes
https://www.amazon.com/s?k=Life+Cuisine&i=grocery&bbn=10329849011,"365 by Whole Foods Market, Burrito Bean Rice, 6 Ounce",4.3,"4,626",,$2.99,$0.50,Yes
https://www.amazon.com/s?k=Life+Cuisine&i=grocery&bbn=10329849011,Lean Cuisine Cheese Ravioli Frozen Meal,4.4,"2,130",,$3.59,$0.42,Yes
https://www.amazon.com/s?k=Life+Cuisine&i=grocery&bbn=10329849011,"Jimmy Dean Delights Broccoli Cheese Egg'Wich, 4 Count",4.2,"1,058",,$7.69,$0.47,Yes
https://www.amazon.com/s?k=Life+Cuisine&i=grocery&bbn=10329849011,"Amy's Frozen Meals, Chili Mac and Cheese Pasta Bowl, Made with Organic Rice Pasta, Tomatoes and Beans, Gluten Free, 9 oz.",4.4,"2,713",$6.79,$5.99,$0.67,Yes
https://www.amazon.com/s?k=Life+Cuisine&i=grocery&bbn=10329849011,"Healthy Choice Café Steamers Grilled Chicken Pesto With Vegetables Frozen Meal, 9.9 oz.",4.5,"1,579",$4.29,$3.79,$0.38,Yes
https://www.amazon.com/s?k=Life+Cuisine&i=grocery&bbn=10329849011,Lean Cuisine Favorites Spaghetti With Meat Sauce Frozen Meal,4.5,"2,075",,$3.79,$0.33,Yes
https://www.amazon.com/s?k=Life+Cuisine&i=grocery&bbn=10329849011,"Marie Callender's Frozen Meal, Chicken Pot Pie, 15 oz",4.6,"3,251",,$4.69,$0.31,Yes
https://www.amazon.com/s?k=Life+Cuisine&i=grocery&bbn=10329849011,"Jack Link’s Beef Jerky, Zero Sugar, Paleo Friendly Snack with No Artificial Sweeteners, 13g of Protein, (Packaging May Vary), 2.3 Oz",4.1,406,,$5.79,$2.52,Yes
https://www.amazon.com/s?k=Life+Cuisine&i=grocery&bbn=10329849011,"Amy's Frozen Meals, Cheese Enchilada Dinner with Black Beans and Corn, Gluten Free 9 oz.",4.5,"3,046",,$5.99,$0.67,Yes
https://www.amazon.com/s?k=Life+Cuisine&i=grocery&bbn=10329849011,"Marie Callender's Aged Cheddar Cheesy Chicken & Rice Bowl, Frozen Meals, 12 oz, (frozen)",4.4,"1,962",,$4.29,$0.36,Yes
https://www.amazon.com/s?k=Life+Cuisine&i=grocery&bbn=10329849011,"Jell-O Chocolate Vanilla Swirls Sugar Free Ready-to-Eat Pudding Cups Snack, 4 ct Cups",4.6,"6,176",,$2.79,$0.70,Yes
https://www.amazon.com/s?k=Life+Cuisine&i=grocery&bbn=10329849011,"Coca-Cola, Coke Soda, 12 Ounce (Pack of 12)",4.8,"10,100",,$8.99,$0.06,Yes
https://www.amazon.com/s?k=Life+Cuisine&i=grocery&bbn=10329849011,"Grown in Idaho Super Crispy Steak Cut Fries, 28 oz (Frozen)",4.7,"4,435",,$5.99,$0.21,Yes
https://www.amazon.com/s?k=Life+Cuisine&i=grocery&bbn=10329849011,"Healthy Choice Cafe Steamers Chicken Margherita with Balsamic, Frozen Meal, 9.5 oz",4.5,"1,482",$4.29,$3.79,$0.40,Yes
https://www.amazon.com/s?k=Life+Cuisine&i=grocery&bbn=10329849011,"Caulipower, Pizza Veggie, 10.9 Ounce",4.3,"2,551",,$8.49,$0.78,Yes
https://www.amazon.com/s?k=Life+Cuisine&i=grocery&bbn=10329849011,"Healthy Choice Simply Steamers Grilled Chicken Marsala, Frozen Meal, 9.9 oz",4.4,"1,496",,$4.69,$0.47,Yes
https://www.amazon.com/s?k=Life+Cuisine&i=grocery&bbn=10329849011,"Alexia Crispy Rosemary Fries with Sea Salt, Non-GMO Ingredients, 16 oz (Frozen)",4.5,"11,981",$6.99,$6.49,$0.41,Yes
https://www.amazon.com/s?k=Life+Cuisine&i=grocery&bbn=10329849011,"Amazon Brand - Aplenty, General Tso's Chicken, 22 oz (Frozen)",4.2,"1,185",,$7.47,$0.34,Yes
https://www.amazon.com/s?k=Life+Cuisine&i=grocery&bbn=10329849011,"vitaminwater zero sugar Look Blueberry Hibiscus, 20 Fl Oz",4.6,"23,891",,$1.89,$0.09,Yes
https://www.amazon.com/s?k=Life+Cuisine&i=grocery&bbn=10329849011,"Evol Chicken Enchilada Bake, Single Serve, Gluten Free, 20 Grams of Protein Per Serving, 9 oz (frozen)",4.2,"1,578",,$4.69,$0.52,Yes
https://www.amazon.com/s?k=Life+Cuisine&i=grocery&bbn=10329849011,"Amy's Frozen Meals, Cheese Enchilada Entree, Gluten Free, 9 oz.",4.5,"5,103",,$5.99,$0.67,Yes
https://www.amazon.com/s?k=amy%27s+kitchen&i=grocery&bbn=10329849011&rh=p_89%3AAmy%27s,"Amy's Soup, Vegan, Gluten Free, Organic Lentil, 14.5 Ounce",4.6,"1,991",,$4.39,$0.30,Yes
https://www.amazon.com/s?k=amy%27s+kitchen&i=grocery&bbn=10329849011&rh=p_89%3AAmy%27s,"Amy's Frozen Meals, Veggie Loaf and Organic Mashed Potatoes, Made with Mushrooms and Broccoli, Vegan & Gluten Free, 10 oz.",4.3,704,$6.79,$5.99,$0.60,Yes
https://www.amazon.com/s?k=amy%27s+kitchen&i=grocery&bbn=10329849011&rh=p_89%3AAmy%27s,"Amy's Soup, Vegan, Organic Minestrone, (Pasta, Beans and Veggies) Low Fat, 14.1 oz",4.5,437,,$4.59,$0.33,Yes
https://www.amazon.com/s?k=amy%27s+kitchen&i=grocery&bbn=10329849011&rh=p_89%3AAmy%27s,"Amy's Refried Beans, Traditional, Gluten Free, Organic & Vegetarian, 15.4 Ounce",4.7,994,,$4.39,$0.29,Yes
https://www.amazon.com/s?k=amy%27s+kitchen&i=grocery&bbn=10329849011&rh=p_89%3AAmy%27s,"Amy's Chili, Black Bean, Medium Spice, Gluten Free & Organic Vegetarian Chili, Low Fat, 14.7 Oz",4.6,741,,$4.59,$0.31,Yes
https://www.amazon.com/s?k=amy%27s+kitchen&i=grocery&bbn=10329849011&rh=p_89%3AAmy%27s,"Amy's Chili, Spicy Organic Vegetarian Chili, Gluten Free, 14.7 Oz",4.5,"6,218",,$4.59,$0.31,Yes
https://www.amazon.com/s?k=amy%27s+kitchen&i=grocery&bbn=10329849011&rh=p_89%3AAmy%27s,One 15.4 oz Amy's Organic Refried Vegetarian Black Beans,4.7,"1,086",,$4.39,$0.29,Yes
https://www.amazon.com/s?k=amy%27s+kitchen&i=grocery&bbn=10329849011&rh=p_89%3AAmy%27s,"Amy's Chili, Medium Spice, Gluten Free & Organic Vegetarian Chili, 14.7 Oz",4.5,"2,021",,$4.59,$0.31,Yes
https://www.amazon.com/s?k=amy%27s+kitchen&i=grocery&bbn=10329849011&rh=p_89%3AAmy%27s,"Amy's Broccoli Pot Pie with Cheddar Cheese Sauce, 7.5 Ounce",4.2,835,$5.99,$5.39,$0.72,Yes
https://www.amazon.com/s?k=amy%27s+kitchen&i=grocery&bbn=10329849011&rh=p_89%3AAmy%27s,"Amy's Soup, Organic Black Bean Vegetable, Low Fat, Vegan & Gluten Free, 14.5 oz",4.5,"1,059",,$4.39,$0.30,Yes
https://www.amazon.com/s?k=amy%27s+kitchen&i=grocery&bbn=10329849011&rh=p_89%3AAmy%27s,"Amy's Refried Beans, Traditional, Light in Sodium, Gluten Free, Organic & Vegetarian, 15.4 Ounce",4.6,477,,$4.39,$0.29,Yes
https://www.amazon.com/s?k=EVOL&i=grocery&bbn=10329849011,"365 by Whole Foods Market, Ravioli Spinach Ricotta Organic, 22 Ounce",4.3,"3,522",,$6.49,$0.30,Yes
https://www.amazon.com/s?k=EVOL&i=grocery&bbn=10329849011,"Lean Cuisine Frozen Meal Ricotta Cheese Spinach Ravioli, Protein Kick Microwave Meal, Cheese and Ravioli Dinner, Frozen Dinner for One, 8 oz",4.4,"1,772",$4.39,$3.79,$0.47,Yes
https://www.amazon.com/s?k=EVOL&i=grocery&bbn=10329849011,"Tyson Fully Cooked Crispy Chicken Strips, 25 oz (Frozen)",4.6,"4,927",$11.99,$11.29,$7.23,Yes
https://www.amazon.com/s?k=EVOL&i=grocery&bbn=10329849011,"Marie Callender's Frozen Meal, Chicken Pot Pie, 15 oz",4.6,"3,251",,$4.69,$0.31,Yes
https://www.amazon.com/s?k=EVOL&i=grocery&bbn=10329849011,"Amy's Broccoli Pot Pie with Cheddar Cheese Sauce, 7.5 Ounce",4.2,835,$5.99,$5.39,$0.72,Yes
https://www.amazon.com/s?k=EVOL&i=grocery&bbn=10329849011,"Deep Indian Kitchen, Chicken Tikka Masala, 9oz (Frozen)",4.5,663,,$6.69,$0.74,Yes
https://www.amazon.com/s?k=EVOL&i=grocery&bbn=10329849011,Jimmy Dean Delights Turkey Sausage Egg White and Cheese English Muffin Breakfast Sandwiches 4 Count (Frozen),4.5,"2,565",,$7.69,$0.38,Yes
https://www.amazon.com/s?k=EVOL&i=grocery&bbn=10329849011,"Healthy Choice Simply Steamers Chicken & Vegetable Stir Fry, Frozen Meal, 9.25 oz",4.4,"1,778",,$4.69,$0.51,Yes
https://www.amazon.com/s?k=EVOL&i=grocery&bbn=10329849011,"Healthy Choice Power Bowls Chicken Marinara With Riced Cauliflower Frozen Meal, Keto Friendly, 9.25 oz.",4.4,"1,106",,$4.99,$0.54,Yes
https://www.amazon.com/s?k=EVOL&i=grocery&bbn=10329849011,"Alexia Crispy Seasoned Potato Puffs Roasted Garlic and Cracked Black Pepper, 19 oz (Frozen)",4.6,"6,479",,$5.99,$0.32,Yes
https://www.amazon.com/s?k=EVOL&i=grocery&bbn=10329849011,"vitaminwater zero Squeezed, 16.9 fl oz (pack of 6)",4.6,"23,891",,$7.49,$0.07,Yes
https://www.amazon.com/s?k=EVOL&i=grocery&bbn=10329849011,"Applegate, Natural Chicken & Sage Breakfast Sausage, 7oz (Frozen)",4.7,"1,692",,$6.29,$14.38,Yes
https://www.amazon.com/s?k=EVOL&i=grocery&bbn=10329849011,"Healthy Choice Cafe Steamers Frozen Dinner, Four Cheese Ravioli & Chicken Marinara, Packed with Protein, 10 Ounce",4.4,"1,592",$4.29,$3.79,$0.38,Yes
https://www.amazon.com/s?k=EVOL&i=grocery&bbn=10329849011,Lean Cuisine Favorites Glazed Turkey Tenderloins Frozen Meal,4.4,959,,$3.99,$0.44,Yes
https://www.amazon.com/s?k=EVOL&i=grocery&bbn=10329849011,"El Monterey Chicken and Cheese Flour Taquitos, 21 Pack",4.5,"2,220",,$8.49,$0.40,Yes
https://www.amazon.com/s?k=EVOL&i=grocery&bbn=10329849011,"Jimmy Dean Simple Scrambles® Bacon, 5.35 oz.",4.5,"2,708",,$3.39,$0.63,Yes
https://www.amazon.com/s?k=EVOL&i=grocery&bbn=10329849011,"Healthy Choice Café Steamers Grilled Chicken Pesto With Vegetables Frozen Meal, 9.9 oz.",4.5,"1,579",$4.29,$3.79,$0.38,Yes
https://www.amazon.com/s?k=EVOL&i=grocery&bbn=10329849011,"Amy's Frozen Entrees, Chinese Noodles & Veggies in a Cashew Cream Sauce, 9.5 oz.",4.4,624,,$5.99,$0.63,Yes
https://www.amazon.com/s?k=EVOL&i=grocery&bbn=10329849011,"Amy's Frozen Meal, Country Cheddar Bowl, Made with Organic Potatoes, Carrots and Broccoli, 9.5 oz.",4.5,816,,$5.99,$0.63,Yes
https://www.amazon.com/s?k=EVOL&i=grocery&bbn=10329849011,Stouffer's Family Size Grandma's Chicken Vegetable Rice Bake Frozen Meal,4.5,"1,110",$11.99,$10.99,$0.31,Yes
https://www.amazon.com/s?k=EVOL&i=grocery&bbn=10329849011,"Jimmy Dean Sausage, Egg and Cheese Croissant Breakfast Sandwich, 8 Count (Frozen)",4.7,"9,491",$12.99,$11.49,$1.44,Yes
https://www.amazon.com/s?k=EVOL&i=grocery&bbn=10329849011,"Birds Eye Steamfresh Veggie Made 100% Vegetable Pasta, Rotini Alfredo, 10 oz (frozen)",4.3,715,,$4.79,$0.48,Yes
https://www.amazon.com/s?k=EVOL&i=grocery&bbn=10329849011,"Birds Eye Steamfresh Long Grain White Rice with Mixed Vegetables, 10 OZ",4.6,"1,684",,$2.49,$0.25,Yes
https://www.amazon.com/s?k=EVOL&i=grocery&bbn=10329849011,"Dole, Diced Pears in Juice, 4 Ounce (Pack of 4)",4.7,"2,183",,$4.39,$0.27,Yes
https://www.amazon.com/s?k=Hot+Pockets&i=grocery&bbn=10329849011,"Totino's Pizza Rolls, Triple Cheese, 50 ct, 24.8 oz (frozen)",4.5,"1,926",,$6.79,$0.27,Yes
https://www.amazon.com/s?k=Hot+Pockets&i=grocery&bbn=10329849011,"Dole Fruit Bowls, Mandarin Oranges in 100% Fruit Juice, 4 Ounce - 12 cups (Pack of 1)",4.7,"1,747",,$10.49,$0.22,Yes
https://www.amazon.com/s?k=Hot+Pockets&i=grocery&bbn=10329849011,"Farm Rich Breaded Mozzarella Cheese Sticks, Frozen, 24 Ounces",4.6,"8,532",,$8.29,$0.35,Yes
https://www.amazon.com/s?k=Hot+Pockets&i=grocery&bbn=10329849011,"Jimmy Dean Sausage, Egg and Cheese Croissant Breakfast Sandwich, 8 Count (Frozen)",4.7,"9,491",$12.99,$11.49,$1.44,Yes
https://www.amazon.com/s?k=Hot+Pockets&i=grocery&bbn=10329849011,"LIFEWTR Premium Purified Water, pH Balanced with Electrolytes, 100% recycled plastic bottles, 33.8 Fl Oz, 1L (Pack of 6)",4.8,"22,887",,$9.29,$0.05,Yes
https://www.amazon.com/s?k=Hot+Pockets&i=grocery&bbn=10329849011,"Tyson Honey BBQ Chicken Strips, 25 oz (Frozen)",4.5,"2,725",$11.99,$11.29,$7.23,Yes
https://www.amazon.com/s?k=Hot+Pockets&i=grocery&bbn=10329849011,DEVOUR White Cheddar Mac & Cheese with Smoked Bacon Frozen Meal (12 oz Box),4.5,"1,536",,$4.29,$0.36,Yes
https://www.amazon.com/s?k=Hot+Pockets&i=grocery&bbn=10329849011,DIGIORNO Frozen Pizza - Frozen Pepperoni Pizza - 27.5 oz Rising Crust Pizza,4.7,"7,418",,$7.99,$0.29,Yes
https://www.amazon.com/s?k=Hot+Pockets&i=grocery&bbn=10329849011,"Cheetos Crunchy Flamin' Hot Cheese Flavored Snacks, 8.5 Ounce",4.8,"13,247",,$4.79,$0.56,Yes
https://www.amazon.com/s?k=Hot+Pockets&i=grocery&bbn=10329849011,Kraft Original Flavor Macaroni and Cheese Meal (7.25 oz Box),4.7,"21,798",,$1.99,$0.27,Yes
https://www.amazon.com/s?k=Hot+Pockets&i=grocery&bbn=10329849011,"Jimmy Dean Biscuit & Sausage Gravy Breakfast Bowl, 9 oz.",4.4,"2,890",,$3.59,$0.40,Yes
https://www.amazon.com/s?k=Hot+Pockets&i=grocery&bbn=10329849011,"Pillsbury Toaster Strudel Patries, Strawberry, 6 ct, 11.7 oz",4.8,"7,208",,$3.49,$0.58,Yes
https://www.amazon.com/s?k=Hot+Pockets&i=grocery&bbn=10329849011,"Swiss Miss Salted Caramel Flavored Hot Cocoa Mix, 1.38 oz 8 ct",4.5,"5,715",,$2.49,$0.23,Yes
https://www.amazon.com/s?k=Hot+Pockets&i=grocery&bbn=10329849011,"Reese's Puffs Breakfast Cereal, Chocolate Peanut Butter with Whole Grain, 19.7 oz",4.8,"2,419",,$7.69,$0.39,Yes
https://www.amazon.com/s?k=Hot+Pockets&i=grocery&bbn=10329849011,"Post Cocoa Pebbles Cereal, 15 Oz",4.8,"4,775",,$5.79,$0.39,Yes
https://www.amazon.com/s?k=Hot+Pockets&i=grocery&bbn=10329849011,"Frank's RedHot Original Hot Sauce (Keto Friendly), 12 fl oz",4.8,"5,651",,$4.69,$0.39,Yes
https://www.amazon.com/s?k=Hot+Pockets&i=grocery&bbn=10329849011,Oscar Mayer Bologna Sliced Deli Sandwich Lunch Meat (16 oz Pack),4.6,"4,357",,$3.59,$3.59,Yes
https://www.amazon.com/s?k=Hot+Pockets&i=grocery&bbn=10329849011,"Jimmy Dean Pancakes and Sausage on a Stick Frozen Breakfast, 12 Count",4.7,"9,656",,$10.29,$0.86,Yes
https://www.amazon.com/s?k=Hot+Pockets&i=grocery&bbn=10329849011,"White Castle, Beef Cheeseburger Sandwich, 11oz.",4.5,"3,310",,$5.99,$8.71,Yes
https://www.amazon.com/s?k=Hot+Pockets&i=grocery&bbn=10329849011,"Jimmy Dean Sausage, Egg And Cheese Biscuit Breakfast Sandwiches, 8 Count (Frozen)",4.6,"2,127",$12.99,$11.49,$1.44,Yes
https://www.amazon.com/s?k=Hot+Pockets&i=grocery&bbn=10329849011,"Maruchan Ramen Noodles Chicken Flavor, 3 Ounce, Pack of 6",4.7,"7,961",,$2.49,$0.14,Yes
https://www.amazon.com/s?k=Hot+Pockets&i=grocery&bbn=10329849011,"Grown in Idaho Crispy Potato Puffs, 28 oz (Frozen)",4.7,"3,306",,$5.99,$0.21,Yes
https://www.amazon.com/s?k=Hot+Pockets&i=grocery&bbn=10329849011,DIGIORNO Frozen Pizza - Three Meat Pizza - 29.8 oz Rising Crust Pizza,4.6,"2,546",,$7.99,$0.27,Yes
https://www.amazon.com/s?k=Hot+Pockets&i=grocery&bbn=10329849011,"Breakfast Pack Breakfast Cereal Multi-Pack With 8 Varieties, 9.14 oz, 8 ct",4.7,"2,649",$6.99,$6.49,$0.71,Yes
https://www.amazon.com/s?k=Life+Cuisine&i=grocery&bbn=10329849011,"Amazon Brand - Aplenty, Chicken Tikka Masala with Basmati Saffron Rice, 10 oz (Frozen)",4.4,"1,052",,$5.12,$0.51,Yes
https://www.amazon.com/s?k=Life+Cuisine&i=grocery&bbn=10329849011,"WHITE CASTLE Burger, 29.28 oz (frozen)",4.6,"3,570",$15.99,$14.29,$0.89,Yes
https://www.amazon.com/s?k=Life+Cuisine&i=grocery&bbn=10329849011,"Marie Callender's Chicken Pot Pie, Frozen Meal, 10 oz",4.6,"11,146",,$3.69,$0.37,Yes
https://www.amazon.com/s?k=Life+Cuisine&i=grocery&bbn=10329849011,"Healthy Choice Cafe Steamers Grilled Chicken Marinara with Parmesan, Frozen Meal, 9.5 oz",4.5,"3,479",,$3.79,$0.40,Yes
https://www.amazon.com/s?k=Life+Cuisine&i=grocery&bbn=10329849011,"Coca-Cola, 7.5 fl oz (pack of 10)",4.8,"3,691",,$6.49,$0.09,Yes
https://www.amazon.com/s?k=Life+Cuisine&i=grocery&bbn=10329849011,"Healthy Choice Simply Steamers Chicken & Vegetable Stir Fry, Frozen Meal, 9.25 oz",4.4,"1,778",,$4.69,$0.51,Yes
https://www.amazon.com/s?k=Life+Cuisine&i=grocery&bbn=10329849011,"McCormick Crushed Red Pepper, 1.5 oz",4.8,"7,261",,$2.79,$1.86,Yes
https://www.amazon.com/s?k=Life+Cuisine&i=grocery&bbn=10329849011,"Healthy Choice Café Steamers Barbecue Seasoned Steak With Potatoes Frozen Meal, 9.5 oz.",4.4,"1,887",$4.29,$3.79,$0.40,Yes
https://www.amazon.com/s?k=Life+Cuisine&i=grocery&bbn=10329849011,"Healthy Choice Power Bowls Chicken Marinara With Riced Cauliflower Frozen Meal, Keto Friendly, 9.25 oz.",4.4,"1,106",,$4.99,$0.54,Yes
https://www.amazon.com/s?k=Life+Cuisine&i=grocery&bbn=10329849011,"Sabra Snackers Guacamole And Rolled Tortilla Chips, Individual Guacamole For On The Go Snacks, 2.8 Oz",4.4,"1,874",,$2.79,$1.00,Yes
https://www.amazon.com/s?k=Life+Cuisine&i=grocery&bbn=10329849011,Stouffer's Lasagna with Meat Sauce Frozen Meal,4.6,"3,491",$5.99,$5.39,$0.28,Yes
https://www.amazon.com/s?k=Life+Cuisine&i=grocery&bbn=10329849011,"Entenmann's Little Bites Fudge Brownie Mini Muffins made with Real Chocolate, 5 pouches",4.7,"2,615",,$5.39,$0.55,Yes
https://www.amazon.com/s?k=Life+Cuisine&i=grocery&bbn=10329849011,"Amy's Frozen Meals, Mac and Cheese Made with Organic Pasta and Cheddar Cheese, 9.0 oz",4.4,"4,911",,$4.49,$0.50,Yes
https://www.amazon.com/s?k=Life+Cuisine&i=grocery&bbn=10329849011,"Marie Callender's Tender Ginger Beef and Broccoli Bowl, Frozen Meal, 11.8 oz",4.3,"4,868",,$3.99,$0.34,Yes
https://www.amazon.com/s?k=Life+Cuisine&i=grocery&bbn=10329849011,"Amy's Frozen Meals, Pasta Bowl, Broccoli and Cheddar Cheese Bake, Gluten Free, 9.5 oz.",4.6,"1,918",,$5.99,$0.63,Yes
https://www.amazon.com/s?k=Life+Cuisine&i=grocery&bbn=10329849011,"Red Baron, French Bread Pepperoni Pizza, 10.80 oz (Frozen)",4.6,"2,847",$5.29,$4.59,$0.43,Yes
https://www.amazon.com/s?k=Life+Cuisine&i=grocery&bbn=10329849011,"Jimmy Dean Delights Bacon and Spinach Frittatas, 6 Count (Frozen)",4.3,"2,431",,$7.99,$0.67,Yes
https://www.amazon.com/s?k=Life+Cuisine&i=grocery&bbn=10329849011,"Gardein Plant-Based Chick'n Sliders, Vegan, Frozen, 11.3 oz. 4-Count",4.4,"5,793",,$5.69,$0.50,Yes
https://www.amazon.com/s?k=Life+Cuisine&i=grocery&bbn=10329849011,"Jimmy Dean Bacon Breakfast Bowl, Single Serve (Frozen)",4.6,"3,452",,$3.39,$0.48,Yes
https://www.amazon.com/s?k=Life+Cuisine&i=grocery&bbn=10329849011,"California Pizza Kitchen Margherita Recipe Vegetarian Meatless Frozen Pizza, Crispy Thin Crust Pizza, 15.5 OZ, 3 slices",4.4,"2,391",$9.29,$8.69,$0.56,Yes
https://www.amazon.com/s?k=Life+Cuisine&i=grocery&bbn=10329849011,"Alexia Organic Yukon Select Fries with a Touch of Sea Salt, Non-GMO Ingredients, 15 oz (Frozen)",4.6,"5,764",,$5.99,$0.40,Yes
https://www.amazon.com/s?k=Life+Cuisine&i=grocery&bbn=10329849011,"Amy's Frozen Meals, Thai Red Curry, Made with Organic Jasmine Rice, Broccoli, Carrots and Coconut Milk, Vegan & Gluten Free, 10 oz.",4.3,544,,$6.49,$0.65,Yes
https://www.amazon.com/s?k=Life+Cuisine&i=grocery&bbn=10329849011,"PLANTERS Lightly Salted Cashew Halves & Pieces, 8 oz Canister - Cashews Roasted in Peanut Oil - Seasoned with Sea Salt - Snacks for Adults - Resealable Lid for Long-Lasting Freshness - Kosher",4.7,"13,286",$8.29,$7.69,$0.96,Yes
https://www.amazon.com/s?k=Life+Cuisine&i=grocery&bbn=10329849011,"vitaminwater zero sugar Gutsy Watermelon Peach, 20 Fl Oz",4.6,"23,891",,$1.89,$0.09,Yes
https://www.amazon.com/s?k=Life+Cuisine&i=grocery&bbn=10329849011,"Jimmy Dean Sausage, Egg And Cheese Breakfast Bowl, 7 Oz (Frozen)",4.7,"3,051",,$3.39,$0.48,Yes
https://www.amazon.com/s?k=Life+Cuisine&i=grocery&bbn=10329849011,"Alexia Crispy Bite-Size Sweet Potato Puffs, Non-GMO Ingredients, 20 oz (Frozen)",4.5,"5,629",,$5.99,$0.30,Yes
https://www.amazon.com/s?k=Life+Cuisine&i=grocery&bbn=10329849011,"Healthy Choice Simply Steamers Grilled Basil Chicken, Frozen Meal, 9.9 Oz (Pack of 1)",4.3,"2,004",,$4.69,$0.47,Yes
https://www.amazon.com/s?k=Life+Cuisine&i=grocery&bbn=10329849011,"Healthy Choice Power Bowls Be'f & Vegetable Stir Fry Frozen Meal, 9.25 oz.",4.1,727,,$4.99,$0.54,Yes
https://www.amazon.com/s?k=Life+Cuisine&i=grocery&bbn=10329849011,"Jimmy Dean Simple Scrambles® Meat Lovers, 5.35 oz.",4.5,"3,086",,$3.39,$10.14,Yes
https://www.amazon.com/s?k=Life+Cuisine&i=grocery&bbn=10329849011,"Healthy Choice Cafe Steamers General Tso's Spicy Chicken, Frozen Meal, 10.3 oz",4.4,"1,941",$4.29,$3.79,$0.37,Yes
https://www.amazon.com/s?k=Life+Cuisine&i=grocery&bbn=10329849011,Hot Pockets Frozen Snacks Premium Pepperoni Pizza Frozen Sandwiches,4.6,"3,868",,$3.39,$6.03,Yes
https://www.amazon.com/s?k=Life+Cuisine&i=grocery&bbn=10329849011,"Amy's Frozen Entrees, Chinese Noodles & Veggies in a Cashew Cream Sauce, 9.5 oz.",4.4,624,,$5.99,$0.63,Yes
https://www.amazon.com/s?k=Life+Cuisine&i=grocery&bbn=10329849011,"Smart Ones Ham & Cheese Scramble with Egg Whites, Ham, Potatoes & Cheese Frozen Meal, 6.49 oz Box",4.2,949,,$2.79,$0.43,Yes
https://www.amazon.com/s?k=Life+Cuisine&i=grocery&bbn=10329849011,"Thai Kitchen Organic Unsweetened Coconut Milk, 13.66 fl oz",4.7,"8,531",,$4.69,$0.34,Yes
https://www.amazon.com/s?k=Life+Cuisine&i=grocery&bbn=10329849011,"Amy's Frozen Meals, Chile Relleno Casserole Bowl, Made with Organic Rice and Black Beans, Gluten Free, 9 oz.",4.5,479,,$6.49,$0.72,Yes
https://www.amazon.com/s?k=Life+Cuisine&i=grocery&bbn=10329849011,"Bob Evans Parmesan & Chives Mashed Cauliflower, Refrigerated Dinner Sides,12 oz, Pack of 1",4.7,5,,$3.99,$3.99,Yes
https://www.amazon.com/s?k=Life+Cuisine&i=grocery&bbn=10329849011,"vitaminwater zero squeezed, electrolyte enhanced water w/ vitamins, lemonade drink, 20 fl oz",4.6,"3,392",,$1.49,$0.07,Yes
https://www.amazon.com/s?k=Life+Cuisine&i=grocery&bbn=10329849011,"California Pizza Kitchen BBQ Recipe Chicken Frozen Pizza, Crispy Thin Crust Pizza, 14.7 OZ",4.6,"2,630",$9.29,$8.69,$0.59,Yes
https://www.amazon.com/s?k=Life+Cuisine&i=grocery&bbn=10329849011,"Dannon Light and Fit Yogurt, Greek, Strawberry, 5.3 oz, 4 pk",4.7,"2,741",,$4.99,$0.24,Yes
https://www.amazon.com/s?k=Life+Cuisine&i=grocery&bbn=10329849011,"Alexia Seasoned Waffle Cut Fries, 20 oz (Frozen)",4.7,"7,962",,$5.79,$0.29,Yes
https://www.amazon.com/s?k=Life+Cuisine&i=grocery&bbn=10329849011,"Campbell's Chunky Soup, Pub-Style Chicken Pot Pie Soup, 18.8 Oz Can",4.6,"3,934",,$3.59,$0.19,Yes
https://www.amazon.com/s?k=Life+Cuisine&i=grocery&bbn=10329849011,"Birds Eye Riced Cauliflower, 10 OZ",4.6,491,,$3.79,$0.38,Yes
https://www.amazon.com/s?k=Life+Cuisine&i=grocery&bbn=10329849011,"Amy's Frozen Meals, Indian Palak Paneer, Made with Basmati Rice, Cheese, Organic Spinach & Beans, Gluten Free, 10 oz.",4.4,"1,167",,$6.49,$0.65,Yes
https://www.amazon.com/s?k=Life+Cuisine&i=grocery&bbn=10329849011,"Evol Fire Grilled Steak, Single Serve, Gluten Free, 18 Grams of Protein Per Serving, 9 oz (frozen)",4.4,"2,112",,$4.69,$0.52,Yes
https://www.amazon.com/s?k=Life+Cuisine&i=grocery&bbn=10329849011,"Healthy Choice Simply Steamers Frozen Dinner, Chicken Fried Rice, Packed with Protein, 10 Ounce",4.3,"1,282",,$4.69,$0.47,Yes
https://www.amazon.com/s?k=Life+Cuisine&i=grocery&bbn=10329849011,"Kitchen Basics Original Chicken Bone Broth, 8.25 fl oz",4.4,"4,275",,$2.59,$0.31,Yes
https://www.amazon.com/s?k=Life+Cuisine&i=grocery&bbn=10329849011,"Barilla Chickpea Rotini Pasta, 8.8 oz - Vegan, Gluten Free, Non GMO & Kosher - High Protein Pasta Made with Plant Based Protein",4.4,"1,810",,$3.29,$0.37,Yes
https://www.amazon.com/s?k=Life+Cuisine&i=grocery&bbn=10329849011,"Quaker Life Breakfast Cereal, Cinnamon, 18 Oz Box",4.8,"4,418",,$6.49,$0.36,Yes
https://www.amazon.com/s?k=Life+Cuisine&i=grocery&bbn=10329849011,"Lawry's Seasoned Salt, 16 oz",4.8,"6,886",,$5.69,$0.36,Yes
https://www.amazon.com/s?k=Life+Cuisine&i=grocery&bbn=10329849011,"Amy's Frozen Meals, Vegetable Lasagna Made with Cheese, Organic Pasta & Vegetables, 9.5 oz.",4.6,840,,$5.99,$0.63,Yes
https://www.amazon.com/s?k=Life+Cuisine&i=grocery&bbn=10329849011,"Entenmann's Little Bites Blueberry Mini Muffins made with Real Blueberries, 20 Count",4.7,"10,254",,$5.39,$0.65,Yes
https://www.amazon.com/s?k=Life+Cuisine&i=grocery&bbn=10329849011,"Simply Lemonade, All Natural Non-GMO, 52 fl oz",4.8,"18,927",,$2.99,$0.06,Yes
https://www.amazon.com/s?k=Life+Cuisine&i=grocery&bbn=10329849011,"Ocean Spray Diet Cranberry Juice Drink, 64 Ounce Bottle",4.7,"1,986",,$4.39,$0.07,Yes
https://www.amazon.com/s?k=Life+Cuisine&i=grocery&bbn=10329849011,"Thai Kitchen Gluten Free Stir Fry Rice Noodles, 14 oz",4.6,"3,411",,$4.99,$0.36,Yes
https://www.amazon.com/s?k=Life+Cuisine&i=grocery&bbn=10329849011,"Dole Fruit Bowls Mixed Fruit in Black Cherry Flavored Gel (Pineapple, Peaches & Pears), Gluten Free Healthy Snack, 4.3 Ounce 4 Cups (Pack of 4)",4.7,"4,780",,$3.79,$0.04,Yes
https://www.amazon.com/s?k=Life+Cuisine&i=grocery&bbn=10329849011,"Bush's Best Black Beans, Creamy, 15 Oz",4.8,"9,739",,$1.49,$0.10,Yes
https://www.amazon.com/s?k=Hot+Pockets&i=grocery&bbn=10329849011,"Tropicana 100% Juice 3-flavor Classic Variety Pack,10 Fl Oz (Pack of 24)",4.6,"40,365",,$17.79,$0.07,Yes
https://www.amazon.com/s?k=Hot+Pockets&i=grocery&bbn=10329849011,"El Monterey Chicken and Cheese Flour Taquitos, 21 Pack",4.5,"2,220",,$8.49,$0.40,Yes
https://www.amazon.com/s?k=Hot+Pockets&i=grocery&bbn=10329849011,"Entenmann's Little Bites Fudge Brownie Mini Muffins made with Real Chocolate, 5 pouches",4.7,"2,615",,$5.39,$0.55,Yes
https://www.amazon.com/s?k=Hot+Pockets&i=grocery&bbn=10329849011,DIGIORNO Frozen Pizza - Frozen Pepperoni Pizza - 22.2 oz Stuffed Crust Pizza,4.7,"2,316",$10.49,$9.99,$0.45,Yes
https://www.amazon.com/s?k=Hot+Pockets&i=grocery&bbn=10329849011,"365 by Whole Foods Market, Chip Pita Sea Salt, 18 Ounce",4.5,"1,880",,$5.99,$0.33,Yes
https://www.amazon.com/s?k=Hot+Pockets&i=grocery&bbn=10329849011,"Hostess Twinkies Multipack, 13.58 Oz, Yellow",4.6,"4,447",,$4.59,$0.34,Yes
https://www.amazon.com/s?k=Hot+Pockets&i=grocery&bbn=10329849011,"Tyson Any'tizers Honey BBQ Boneless Chicken Bites, 24 oz (Frozen)",4.5,"3,438",,$11.79,$7.86,Yes
https://www.amazon.com/s?k=Hot+Pockets&i=grocery&bbn=10329849011,"El Monterey Beef and Bean Burritos â€“ Family Pack of 8 Frozen Burritos, Made with Real Beef, No Artificial Colors, Perfect for Quick Family Meals Pack of 8",4.5,"2,862",,$5.69,$0.18,Yes
https://www.amazon.com/s?k=Hot+Pockets&i=grocery&bbn=10329849011,"Tyson Any'tizers Buffalo Style Bone-In Chicken Wings, 22 oz. (Frozen)",4.6,"3,262",,$11.49,$8.36,Yes
https://www.amazon.com/s?k=Hot+Pockets&i=grocery&bbn=10329849011,"El Monterey Beef, Bean and Cheese flavor Chimichangas – Family Pack of 8 Frozen Chimichangas, Made with Real Beef, Perfect for Quick Family Meals (8 Count)",4.4,925,,$5.69,$0.19,Yes
https://www.amazon.com/s?k=Hot+Pockets&i=grocery&bbn=10329849011,"Tyson Fully Cooked Chicken Nuggets, 70.4 Ounce",4.7,"1,297",$15.99,$14.79,$3.36,Yes
