URL,Title,Rating,Reviews,Original Price,Price,Price/Oz,SNAP Eligible
https://www.amazon.com/s?k=Hot+Pockets&i=grocery&bbn=10329849011,"Simply Fruit Punch Juice Drink, 52 fl oz",4.8,"9,451",,$2.99,$0.06,Yes
https://www.amazon.com/s?k=Hot+Pockets&i=grocery&bbn=10329849011,"Jack Link's Beef Jerky Variety Pack Includes Original and Teriyaki Flavors, On the Go Snacks, 13g of Protein Per Serving, 9 Count of 1.25 Oz Bags",4.7,"31,436",,$19.99,$1.78,Yes
https://www.amazon.com/s?k=Healthy+Choice&i=grocery&bbn=10329849011&rh=p_89%3AHealthy+Choice,"Healthy Choice Cafe Steamers Sweet & Sour Chicken, Frozen Meal, 10 oz",4.4,"1,138",,$3.79,$0.38,Yes
https://www.amazon.com/s?k=Healthy+Choice&i=grocery&bbn=10329849011&rh=p_89%3AHealthy+Choice,"Healthy Choice Zero Verde Chicken Bowl, Low Carb Lifestyle, Single Serve Frozen Meal, 9.5 oz, (frozen)",4.2,160,,$4.79,$0.50,Yes
https://www.amazon.com/s?k=Healthy+Choice&i=grocery&bbn=10329849011&rh=p_89%3AHealthy+Choice,"Healthy Choice Power Bowls Sweet & Zesty BBQ Seasoned Pork, Frozen Meal, 9.5 oz",4.4,259,,$4.40,$0.46,Yes
https://www.amazon.com/s?k=Healthy+Choice&i=grocery&bbn=10329849011&rh=p_89%3AHealthy+Choice,"Healthy Choice Café Steamers Barbecue Seasoned Steak With Potatoes Frozen Meal, 9.5 oz.",4.4,"1,887",$4.29,$3.79,$0.40,Yes
https://www.amazon.com/s?k=Healthy+Choice&i=grocery&bbn=10329849011&rh=p_89%3AHealthy+Choice,"Healthy Choice Simply Steamers Frozen Dinner, Creamy Spinach & Tomato Linguini, 9 Ounce",4.3,"1,729",,$4.69,$0.52,Yes
https://www.amazon.com/s?k=Healthy+Choice&i=grocery&bbn=10329849011&rh=p_89%3AHealthy+Choice,"Healthy Choice Cafe Steamers Chicken Margherita with Balsamic, Frozen Meal, 9.5 oz",4.5,"1,482",$4.29,$3.79,$0.40,Yes
https://www.amazon.com/s?k=Healthy+Choice&i=grocery&bbn=10329849011&rh=p_89%3AHealthy+Choice,"Healthy Choice Cafe Steamers Grilled Chicken Marinara with Parmesan, Frozen Meal, 9.5 oz",4.5,"3,479",,$3.79,$0.40,Yes
https://www.amazon.com/s?k=Healthy+Choice&i=grocery&bbn=10329849011&rh=p_89%3AHealthy+Choice,"Healthy Choice Power Bowls Be'f & Vegetable Stir Fry Frozen Meal, 9.25 oz.",4.1,727,,$4.99,$0.54,Yes
https://www.amazon.com/s?k=Healthy+Choice&i=grocery&bbn=10329849011&rh=p_89%3AHealthy+Choice,"Healthy Choice Cafe Steamers Frozen Dinner, Four Cheese Ravioli & Chicken Marinara, Packed with Protein, 10 Ounce",4.4,"1,592",$4.29,$3.79,$0.38,Yes
https://www.amazon.com/s?k=Healthy+Choice&i=grocery&bbn=10329849011&rh=p_89%3AHealthy+Choice,"Healthy Choice Simply Steamers Chicken & Vegetable Stir Fry, Frozen Meal, 9.25 oz",4.4,"1,778",,$4.69,$0.51,Yes
https://www.amazon.com/s?k=Healthy+Choice&i=grocery&bbn=10329849011&rh=p_89%3AHealthy+Choice,"Healthy Choice Chicken With Rice Soup Made With Bone Broth, 15 oz",4.4,741,,$3.39,$0.23,Yes
https://www.amazon.com/s?k=Healthy+Choice&i=grocery&bbn=10329849011&rh=p_89%3AHealthy+Choice,"Healthy Choice Simply Steamers Grilled Basil Chicken, Frozen Meal, 9.9 Oz (Pack of 1)",4.3,"2,004",,$4.69,$0.47,Yes
https://www.amazon.com/s?k=Healthy+Choice&i=grocery&bbn=10329849011&rh=p_89%3AHealthy+Choice,"Healthy Choice Café Steamers Grilled Chicken Pesto With Vegetables Frozen Meal, 9.9 oz.",4.5,"1,579",$4.29,$3.79,$0.38,Yes
https://www.amazon.com/s?k=Healthy+Choice&i=grocery&bbn=10329849011&rh=p_89%3AHealthy+Choice,"Healthy Choice Power Bowls Chicken Marinara With Riced Cauliflower Frozen Meal, Keto Friendly, 9.25 oz.",4.4,"1,106",,$4.99,$0.54,Yes
https://www.amazon.com/s?k=Healthy+Choice&i=grocery&bbn=10329849011&rh=p_89%3AHealthy+Choice,"Healthy Choice Simply Steamers Frozen Dinner, Chicken Fried Rice, Packed with Protein, 10 Ounce",4.3,"1,282",,$4.69,$0.47,Yes
https://www.amazon.com/s?k=Healthy+Choice&i=grocery&bbn=10329849011&rh=p_89%3AHealthy+Choice,"Healthy Choice Power Bowls Basil Pesto Chicken With Riced Cauliflower Frozen Meal, Packed with Protein, 9.25 oz.",4.4,"1,023",,$4.99,$0.54,Yes
https://www.amazon.com/s?k=Healthy+Choice&i=grocery&bbn=10329849011&rh=p_89%3AHealthy+Choice,"Healthy Choice Lentil Vegetable Soup Made With Chicken Bone Broth, 15 oz",4.3,562,,$2.69,$0.18,Yes
https://www.amazon.com/s?k=Healthy+Choice&i=grocery&bbn=10329849011&rh=p_89%3AHealthy+Choice,"Healthy Choice Chicken Noodle Soup Made With Bone Broth, 15 oz",4.3,750,,$3.08,$0.21,Yes
https://www.amazon.com/s?k=Healthy+Choice&i=grocery&bbn=10329849011&rh=p_89%3AHealthy+Choice,"Healthy Choice Simply Steamers Grilled Chicken Marsala, Frozen Meal, 9.9 oz",4.4,"1,496",,$4.69,$0.47,Yes
https://www.amazon.com/s?k=Healthy+Choice&i=grocery&bbn=10329849011&rh=p_89%3AHealthy+Choice,"Healthy Choice Cafe Steamers General Tso's Spicy Chicken, Frozen Meal, 10.3 oz",4.4,"1,941",$4.29,$3.79,$0.37,Yes
https://www.amazon.com/s?k=Healthy+Choice&i=grocery&bbn=10329849011&rh=p_89%3AHealthy+Choice,"Healthy Choice Power Bowls Adobo Chicken, Frozen Meal, 9.75 oz",4.3,513,,$4.99,$0.51,Yes
https://www.amazon.com/s?k=Healthy+Choice&i=grocery&bbn=10329849011&rh=p_89%3AHealthy+Choice,"Healthy Choice Power Bowls Cuban-Inspired Pork, Frozen Meal, 9.5 OZ",4.3,565,,$4.79,$0.50,Yes
https://www.amazon.com/s?k=Healthy+Choice&i=grocery&bbn=10329849011&rh=p_89%3AHealthy+Choice,"Healthy Choice Zero Sesame Chicken With Zoodles Bowl, Low Carb, Single Serve Frozen Meal, 9.5 oz, (frozen)",4.4,172,,$4.56,$0.48,Yes
https://www.amazon.com/s?k=Life+Cuisine&i=grocery&bbn=10329849011,"Life Cuisine Frozen Meal Vermont White Cheddar Mac and Broccoli Bowl, Veggie Lovers Microwave Meal, Vegetarian Frozen Dinner for One",4.3,775,,$4.39,$0.40,Yes
https://www.amazon.com/s?k=Life+Cuisine&i=grocery&bbn=10329849011,"Life Cuisine Frozen Meal Pesto Cauliflower Gnocchi Bowl, Veggie Lovers Microwave Meal, Vegetarian Frozen Dinner for One with Veggie Pasta",3.9,67,,$4.30,$0.43,Yes
https://www.amazon.com/s?k=Life+Cuisine&i=grocery&bbn=10329849011,Lean Cuisine Favorites Five Cheese Rigatoni Frozen Meal,4.5,"2,546",,$3.49,$0.35,Yes
https://www.amazon.com/s?k=Life+Cuisine&i=grocery&bbn=10329849011,"Lean Cuisine Frozen Meal Ricotta Cheese Spinach Ravioli, Protein Kick Microwave Meal, Cheese and Ravioli Dinner, Frozen Dinner for One, 8 oz",4.4,"1,772",$4.39,$3.79,$0.47,Yes
https://www.amazon.com/s?k=Life+Cuisine&i=grocery&bbn=10329849011,"Lean Cuisine Features Herb Roasted Chicken Frozen Meal, meals-entrees, 8 Oz",4.4,"1,680",,$3.79,$0.47,Yes
https://www.amazon.com/s?k=Life+Cuisine&i=grocery&bbn=10329849011,Lean Cuisine Features Chicken Parmesan Frozen Meal,4.3,"1,904",,$3.79,$0.35,Yes
https://www.amazon.com/s?k=Life+Cuisine&i=grocery&bbn=10329849011,"Lean Cuisine Frozen Meal Chicken in Sweet BBQ Sauce, Protein Kick Microwave Meal, Microwave Chicken Dinner, Frozen Dinner for One, 8.5 oz",4.3,933,,$3.79,$0.45,Yes
https://www.amazon.com/s?k=Life+Cuisine&i=grocery&bbn=10329849011,"Lean Cuisine Bowls Roasted Turkey and Vegetables Frozen Meal, 10 Ounce",4.4,376,,$4.59,$0.46,Yes
https://www.amazon.com/s?k=Life+Cuisine&i=grocery&bbn=10329849011,"egglife egg white wraps, Original, Egg White Wraps, 6 Total Wraps - Gluten Free, Dairy Free, No Flour, Sugar Free, Keto Friendly, Paleo, Low Net Carb, Protein Packed",4.2,"2,335",,$5.49,$0.92,Yes
https://www.amazon.com/s?k=Life+Cuisine&i=grocery&bbn=10329849011,"Glad ForceFlex Tall Kitchen Drawstring Trash Bags – 13 Gallon Trash Bag, Fresh Clean scent with Febreze Freshness – 80 Count (Package May Vary)",4.7,"46,946",$19.99,$17.59,$0.22,No
https://www.amazon.com/s?k=Life+Cuisine&i=grocery&bbn=10329849011,"Jimmy Dean Morning Combos, Mini Maple Pancakes And Maple Sausage Bites, 3.27 Oz.",4.3,"1,759",$3.79,$3.08,$0.93,Yes
https://www.amazon.com/s?k=Life+Cuisine&i=grocery&bbn=10329849011,"Amazon Brand - Aplenty, Truffle Oil & Mushrooms Thin and Crispy Pizza, 14.7 oz (Frozen)",4.3,979,,$7.84,$0.53,Yes
https://www.amazon.com/s?k=Life+Cuisine&i=grocery&bbn=10329849011,"Healthy Choice Power Bowls Basil Pesto Chicken With Riced Cauliflower Frozen Meal, Packed with Protein, 9.25 oz.",4.4,"1,023",,$4.99,$0.54,Yes
https://www.amazon.com/s?k=Life+Cuisine&i=grocery&bbn=10329849011,"365 by Whole Foods Market, Pizza Cheese Cauliflower Crust, 12 Ounce",4.0,"4,214",,$6.99,$0.58,Yes
https://www.amazon.com/s?k=Life+Cuisine&i=grocery&bbn=10329849011,"Healthy Choice Simply Steamers Frozen Dinner, Creamy Spinach & Tomato Linguini, 9 Ounce",4.3,"1,729",,$4.69,$0.52,Yes
https://www.amazon.com/s?k=Life+Cuisine&i=grocery&bbn=10329849011,"Dole Frozen Dark Chocolate Dippers, Dark Chocolate Covered Banana Slices, 1.55 Oz Pack, 6 Snacks",4.5,"2,110",$5.29,$4.59,$0.49,Yes
https://www.amazon.com/s?k=Life+Cuisine&i=grocery&bbn=10329849011,"California Pizza Kitchen Signature Uncured Pepperoni, Mushroom Sausage Frozen Pizza, Cauliflower Crust Pizza Gluten Free, 12.4 OZ",4.6,905,,$9.69,$0.78,Yes
https://www.amazon.com/s?k=Life+Cuisine&i=grocery&bbn=10329849011,"Jimmy Dean Delights Turkey Sausage Breakfast Bowl, Single Serve (Frozen)",4.5,"2,543",,$3.39,$0.48,Yes
https://www.amazon.com/s?k=Life+Cuisine&i=grocery&bbn=10329849011,"Evol Butternut Squash and Sage Ravioli, Single Serve, Vegetarian, 12 Grams of Protein Per Serving, 8.13 oz (frozen)",4.4,"1,288",,$4.69,$0.58,Yes
https://www.amazon.com/s?k=Life+Cuisine&i=grocery&bbn=10329849011,Lean Cuisine Favorites Spaghetti With Meatballs Frozen Meal,4.4,"1,220",,$3.59,$0.38,Yes
https://www.amazon.com/s?k=Life+Cuisine&i=grocery&bbn=10329849011,"Lean Cuisine Frozen Meal Meatloaf with Mashed Potatoes, Protein Kick Microwave Meal, Meatloaf Dinner, Frozen Dinner for One",4.4,"3,453",,$3.79,$0.40,Yes
https://www.amazon.com/s?k=Life+Cuisine&i=grocery&bbn=10329849011,"Lean Cuisine Marketplace, Tortilla Crusted Fish Vegetables and Rice, Meal Entrees, 8 Oz",4.4,765,,$3.99,$0.50,Yes
https://www.amazon.com/s?k=Life+Cuisine&i=grocery&bbn=10329849011,"Lean Cuisine Favorites Chicken Fettuccini, Frozen Meal with No Preservatives, Delicious Pasta, Ready in Minutes, Meals-Entrees, 9.25 Oz",4.5,"1,786",,$3.59,$0.39,Yes
https://www.amazon.com/s?k=Life+Cuisine&i=grocery&bbn=10329849011,"CAULIPOWER Margherita Pizza, 10.9 Ounce",4.3,"3,196",,$8.49,$0.78,Yes
https://www.amazon.com/s?k=Stouffer%E2%80%99s&i=grocery&bbn=10329849011&rh=p_89%3AStouffer%27s,Stouffer's Large Size Meat Lovers Lasagna Frozen Meal,4.6,"1,754",$5.99,$5.39,$0.30,Yes
https://www.amazon.com/s?k=Stouffer%E2%80%99s&i=grocery&bbn=10329849011&rh=p_89%3AStouffer%27s,"STOUFFER'S Fettuccini Alfredo, Frozen Meal",4.5,"2,088",,$3.79,$0.33,Yes
https://www.amazon.com/s?k=Stouffer%E2%80%99s&i=grocery&bbn=10329849011&rh=p_89%3AStouffer%27s,"Stouffer's Family Size Stuffed Peppers Frozen Dinner,UNKNOWN",4.6,685,,$11.29,$0.34,Yes
https://www.amazon.com/s?k=Stouffer%E2%80%99s&i=grocery&bbn=10329849011&rh=p_89%3AStouffer%27s,"STOUFFER’S Roast Turkey, Frozen Meal",4.4,"2,024",,$3.79,$0.40,Yes
https://www.amazon.com/s?k=Stouffer%E2%80%99s&i=grocery&bbn=10329849011&rh=p_89%3AStouffer%27s,Stouffer's Meat Lovers Lasagna Frozen Meal,4.5,"1,209",,$3.79,$0.38,Yes
https://www.amazon.com/s?k=Stouffer%E2%80%99s&i=grocery&bbn=10329849011&rh=p_89%3AStouffer%27s,"Stouffer's, Chicken Enchilada & Rice & Vegetables, 57oz.",4.0,510,,$18.29,$0.32,Yes
https://www.amazon.com/s?k=Stouffer%E2%80%99s&i=grocery&bbn=10329849011&rh=p_89%3AStouffer%27s,Stouffer's Stuffed Peppers Large Size Frozen Meal,4.5,"2,179",$5.99,$5.39,$0.35,Yes
https://www.amazon.com/s?k=Marie+Callender%E2%80%99s&i=grocery&bbn=10329849011&rh=p_89%3AMarie+Callender%27s,"Marie Callender's Frozen Pie Dessert, Pumpkin, 36 oz",4.5,951,,$8.18,$0.23,Yes
https://www.amazon.com/s?k=Marie+Callender%E2%80%99s&i=grocery&bbn=10329849011&rh=p_89%3AMarie+Callender%27s,"Marie Callender's Fettuccini With Chicken and Broccoli Meal To Share, Frozen Meal, 26 oz",4.4,518,,$7.49,$0.29,Yes
https://www.amazon.com/s?k=Marie+Callender%E2%80%99s&i=grocery&bbn=10329849011&rh=p_89%3AMarie+Callender%27s,"Marie Callender's Dutch Apple Pie Frozen Dessert, 38 oz",4.7,"1,513",,$8.69,$0.23,Yes
https://www.amazon.com/s?k=Marie+Callender%E2%80%99s&i=grocery&bbn=10329849011&rh=p_89%3AMarie+Callender%27s,"Marie Callender's Frozen Pie Dessert, Southern Pecan, 32 oz",4.5,975,$10.29,$9.49,$0.30,Yes
https://www.amazon.com/s?k=Marie+Callender%E2%80%99s&i=grocery&bbn=10329849011&rh=p_89%3AMarie+Callender%27s,"Marie Callender's Frozen Dinner, Chicken & Dumplings, 13.5 oz",4.4,58,,$4.09,$0.30,Yes
https://www.amazon.com/s?k=Marie+Callender%E2%80%99s&i=grocery&bbn=10329849011&rh=p_89%3AMarie+Callender%27s,"Marie Callender's Frozen Dinner, Roasted Garlic Chicken, Packed with Protein, 13 oz",4.3,129,,$2.89,$0.22,Yes
https://www.amazon.com/s?k=Marie+Callender%E2%80%99s&i=grocery&bbn=10329849011&rh=p_89%3AMarie+Callender%27s,"Marie Callender's Frozen Pastry Pie Crusts, 16 oz (frozen)",4.7,"1,438",,$4.99,$0.31,Yes
https://www.amazon.com/s?k=amy%27s+kitchen&i=grocery&bbn=10329849011&rh=p_89%3AAmy%27s,"Amy's, Pizza Margherita, 13 Ounce",4.5,"3,753",,$9.99,$0.77,Yes
https://www.amazon.com/s?k=amy%27s+kitchen&i=grocery&bbn=10329849011&rh=p_89%3AAmy%27s,"Amy's Frozen Meals, Cheese Enchilada Dinner with Black Beans and Corn, Gluten Free 9 oz.",4.5,"3,046",,$5.99,$0.67,Yes
https://www.amazon.com/s?k=amy%27s+kitchen&i=grocery&bbn=10329849011&rh=p_89%3AAmy%27s,"Amy's Soup, Organic Split Pea, Low Fat, Vegan & Gluten Free, 14.1 oz",4.5,"2,051",,$4.39,$0.31,Yes
https://www.amazon.com/s?k=amy%27s+kitchen&i=grocery&bbn=10329849011&rh=p_89%3AAmy%27s,"Amy's Soup, Organic Chunky Tomato Bisque, Made with Onions, Gluten Free, 14.5 oz",4.6,"4,933",,$4.39,$0.30,Yes
https://www.amazon.com/s?k=amy%27s+kitchen&i=grocery&bbn=10329849011&rh=p_89%3AAmy%27s,"Amy's Soup, Organic Cream of Tomato, Light in Sodium, Low Fat, Gluten Free, 14.5 oz",4.6,285,,$4.29,$0.30,Yes
https://www.amazon.com/s?k=amy%27s+kitchen&i=grocery&bbn=10329849011&rh=p_89%3AAmy%27s,"Amy's Soup, Organic Lentil Vegetable, Vegan & Gluten Free, 14.5 oz",4.6,779,,$4.39,$0.30,Yes
https://www.amazon.com/s?k=amy%27s+kitchen&i=grocery&bbn=10329849011&rh=p_89%3AAmy%27s,"Amy's Chili, Light in Sodium, Spicy, Gluten Free & Organic Vegetarian Chili, 14.7 Oz",4.4,"4,600",,$5.29,$0.36,Yes
https://www.amazon.com/s?k=amy%27s+kitchen&i=grocery&bbn=10329849011&rh=p_89%3AAmy%27s,"Amy's Soup, Organic Alphabet, Made with Potatoes, Carrots and Green Beans, Low Fat, Vegan, 14.1 oz",4.6,"4,933",$5.99,$4.99,$0.03,Yes
https://www.amazon.com/s?k=amy%27s+kitchen&i=grocery&bbn=10329849011&rh=p_89%3AAmy%27s,"Amy's Soup, Mushroom Bisque with Porcini, Gluten Free, 14 oz.",4.5,"1,387",$4.99,$4.49,$0.32,Yes
https://www.amazon.com/s?k=amy%27s+kitchen&i=grocery&bbn=10329849011&rh=p_89%3AAmy%27s,"Amy's Soup, Southwestern Vegetable, Fired Roasted 14.3 oz",4.6,877,,$4.39,$0.31,Yes
https://www.amazon.com/s?k=amy%27s+kitchen&i=grocery&bbn=10329849011&rh=p_89%3AAmy%27s,"Amy's Soup, Organic Chunky Tomato Bisque, Light in Sodium, Gluten Free, 14.5 oz",4.7,546,,$4.39,$0.30,Yes
https://www.amazon.com/s?k=amy%27s+kitchen&i=grocery&bbn=10329849011&rh=p_89%3AAmy%27s,"Amy's Frozen Meals, Vegetable Lasagna Made with Cheese, Organic Pasta & Vegetables, 9.5 oz.",4.6,840,,$5.99,$0.63,Yes
https://www.amazon.com/s?k=amy%27s+kitchen&i=grocery&bbn=10329849011&rh=p_89%3AAmy%27s,"Amy's Soup, Organic Split Pea, Light in Sodium, Low Fat, Vegan & Gluten Free, 14.1 oz",4.4,"4,600",,$4.79,$0.34,Yes
https://www.amazon.com/s?k=amy%27s+kitchen&i=grocery&bbn=10329849011&rh=p_89%3AAmy%27s,"Amy's Soup, Organic Chunky Vegetable, Low Fat, Vegan & Gluten Free, 14.3 oz",4.7,624,,$4.39,$0.31,Yes
https://www.amazon.com/s?k=amy%27s+kitchen&i=grocery&bbn=10329849011&rh=p_89%3AAmy%27s,"Amy's Refried Black Beans, Light in Sodium, Gluten Free, Organic & Vegetarian, Canned, 15.4 Ounce",4.6,408,,$4.39,$0.29,Yes
https://www.amazon.com/s?k=amy%27s+kitchen&i=grocery&bbn=10329849011&rh=p_89%3AAmy%27s,"Amy's Soup, No Chicken Noodle Soup, Made with Organic Vegetables, Vegan, 14.1 oz",4.5,"6,218",,$4.69,$0.33,Yes
https://www.amazon.com/s?k=amy%27s+kitchen&i=grocery&bbn=10329849011&rh=p_89%3AAmy%27s,"Amy's Soup, Organic Curried Lentil, Made with Ginger, Turmeric and Beans, Vegan & Gluten Free, 14.5 oz",4.5,"6,218",,$5.79,$0.40,Yes
https://www.amazon.com/s?k=amy%27s+kitchen&i=grocery&bbn=10329849011&rh=p_89%3AAmy%27s,"Amy's Soup, Organic Minestrone, (Pasta, Beans and Veggies) Light in Sodium, Low Fat, Vegan, 14.1 oz",4.5,597,,$3.99,$0.28,Yes
https://www.amazon.com/s?k=amy%27s+kitchen&i=grocery&bbn=10329849011&rh=p_89%3AAmy%27s,"Amy's Frozen Meals, Thai Red Curry, Made with Organic Jasmine Rice, Broccoli, Carrots and Coconut Milk, Vegan & Gluten Free, 10 oz.",4.3,544,,$6.49,$0.65,Yes
https://www.amazon.com/s?k=amy%27s+kitchen&i=grocery&bbn=10329849011&rh=p_89%3AAmy%27s,"Amy's Soup, Organic Lentil, Light in Sodium, Vegan & Gluten Free, 14.5 oz",4.6,"1,110",$5.29,$4.49,$0.31,Yes
https://www.amazon.com/s?k=amy%27s+kitchen&i=grocery&bbn=10329849011&rh=p_89%3AAmy%27s,"Amy's Soup, Organic Cream of Tomato, Low Fat, Gluten Free, 14.5 oz",4.6,675,,$4.49,$0.31,Yes
https://www.amazon.com/s?k=amy%27s+kitchen&i=grocery&bbn=10329849011&rh=p_89%3AAmy%27s,"Amy's Soup, Organic Vegetable Barley (Tomatoes, Carrots and Celery) Low Fat, Vegan, 14.1 oz",4.6,"4,933",,$4.39,$0.31,Yes
https://www.amazon.com/s?k=amy%27s+kitchen&i=grocery&bbn=10329849011&rh=p_89%3AAmy%27s,"Amy's Chili, Light in Sodium, Medium Spice, Gluten Free & Organic Vegetarian Chili, 14.7 Oz",4.4,"1,514",,$4.59,$0.31,Yes
https://www.amazon.com/s?k=amy%27s+kitchen&i=grocery&bbn=10329849011&rh=p_89%3AAmy%27s,"Amy's Frozen Meals, Roasted Poblano Enchilada Entree, Gluten Free, 9.1 oz.",4.4,"1,081",,$5.99,$0.66,Yes
https://www.amazon.com/s?k=EVOL&i=grocery&bbn=10329849011,"Amy's Frozen Meals, Mushroom Risotto Bowl, Made with Parmesan Cheese, Gluten Free, 9.5 oz",4.3,"1,530",,$6.49,$0.68,Yes
https://www.amazon.com/s?k=EVOL&i=grocery&bbn=10329849011,"Impossible™ Chicken Nuggets Made From Plants, Frozen, Fully Cooked,13.5 oz",4.7,"1,480",$9.99,$9.29,$11.01,Yes
https://www.amazon.com/s?k=EVOL&i=grocery&bbn=10329849011,"Amy's Frozen Meals, Pesto Tortellini Pasta Bowl, Made with Parmesan Cheese and Organic Basil, 9.5 oz.",4.5,901,,$5.99,$0.63,Yes
https://www.amazon.com/s?k=EVOL&i=grocery&bbn=10329849011,"California Pizza Kitchen BBQ Recipe Chicken Frozen Pizza, Crispy Thin Crust Pizza, 14.7 OZ",4.6,"2,630",$9.29,$8.69,$0.59,Yes
https://www.amazon.com/s?k=EVOL&i=grocery&bbn=10329849011,"Amy's, Pizza Margherita, 13 Ounce",4.5,"3,753",,$9.99,$0.77,Yes
https://www.amazon.com/s?k=EVOL&i=grocery&bbn=10329849011,"Healthy Choice Simply Steamers Frozen Dinner, Creamy Spinach & Tomato Linguini, 9 Ounce",4.3,"1,729",,$4.69,$0.52,Yes
https://www.amazon.com/s?k=EVOL&i=grocery&bbn=10329849011,"Sweet Earth Big Sur Frozen Breakfast Burrito, Vegan Frozen Burrito 5.5 Oz - Plant Based Protein Microwave Food",3.8,"1,624",,$3.29,$0.60,Yes
https://www.amazon.com/s?k=EVOL&i=grocery&bbn=10329849011,"Rao's Made for Home Meat Lasagna, Frozen Meals, 9 oz, Premium Quality Italian Tomatoes, Pasta, and Fresh Ricotta Cheese",4.2,"1,831",,$5.79,$0.64,Yes
https://www.amazon.com/s?k=EVOL&i=grocery&bbn=10329849011,"Alexia Butternut Squash Risotto with Parmesan Cheese and Sea Salt, Frozen Side, 12 oz",4.2,862,$5.79,$4.99,$0.42,Yes
https://www.amazon.com/s?k=EVOL&i=grocery&bbn=10329849011,"Amy's Frozen Meals, 3 Cheese and Kale Bake Bowl, Made with Organic Rice Pasta and Veggies, Gluten Free, 8.5oz",4.7,"1,246",,$5.99,$0.70,Yes
https://www.amazon.com/s?k=EVOL&i=grocery&bbn=10329849011,"SkinnyPop Original Popcorn, 4.4oz Grocery Size Bags, Skinny Pop, Healthy Popcorn Snacks, Gluten Free",4.7,"11,397",,$3.59,$0.82,Yes
https://www.amazon.com/s?k=EVOL&i=grocery&bbn=10329849011,"Natures Path, Toaster Pastries Frosted Wildberry Acai Organic 6 Count, 11 Ounce",4.2,"2,321",,$4.29,$0.39,Yes
https://www.amazon.com/s?k=EVOL&i=grocery&bbn=10329849011,"Amy's Frozen Meals, Mexican Casserole Bowl, Made with Organic Tomatoes, Corn and Black Beans, Gluten Free, 9.5 oz.",4.5,"1,826",,$5.99,$0.63,Yes
https://www.amazon.com/s?k=EVOL&i=grocery&bbn=10329849011,"Amy's Frozen Meals, Pad Thai, Made with Organic Rice Noodles, Broccoli and Carrots, Vegan & Gluten Free, 9.5 oz",4.3,"4,046",$6.49,$5.99,$0.63,Yes
https://www.amazon.com/s?k=EVOL&i=grocery&bbn=10329849011,"California Pizza Kitchen White Recipe Frozen Pizza, Crispy Thin Crust Pizza, 13.4 OZ",4.3,"1,695",$9.29,$8.69,$0.65,Yes
https://www.amazon.com/s?k=EVOL&i=grocery&bbn=10329849011,"Jimmy Dean Delights Turkey Sausage Breakfast Bowl, Single Serve (Frozen)",4.5,"2,543",,$3.39,$0.48,Yes
https://www.amazon.com/s?k=EVOL&i=grocery&bbn=10329849011,"Amy's Frozen Meals, Brown Rice, Black-Eyed Peas & Veggies Bowl, Made with Organic Tomatoes and Mushrooms, Gluten Free, 9 oz",4.5,839,,$5.99,$0.67,Yes
https://www.amazon.com/s?k=EVOL&i=grocery&bbn=10329849011,"Jimmy Dean Delights Broccoli Cheese Egg'Wich, 4 Count",4.2,"1,058",,$7.69,$0.47,Yes
https://www.amazon.com/s?k=EVOL&i=grocery&bbn=10329849011,"California Pizza Kitchen Margherita Recipe Vegetarian Meatless Frozen Pizza, Crispy Thin Crust Pizza, 15.5 OZ, 3 slices",4.4,"2,391",$9.29,$8.69,$0.56,Yes
https://www.amazon.com/s?k=EVOL&i=grocery&bbn=10329849011,"Amy's Frozen Meals, Roasted Poblano Enchilada Entree, Gluten Free, 9.1 oz.",4.4,"1,081",,$5.99,$0.66,Yes
https://www.amazon.com/s?k=EVOL&i=grocery&bbn=10329849011,"Jimmy Dean Snack Size Sausage Biscuit Sandwiches, 10 Count (Frozen)",4.6,"2,369",,$6.69,$0.39,Yes
https://www.amazon.com/s?k=EVOL&i=grocery&bbn=10329849011,"Amy's Frozen Meals, Chili Mac and Cheese Pasta Bowl, Made with Organic Rice Pasta, Tomatoes and Beans, Gluten Free, 9 oz.",4.4,"2,713",$6.79,$5.99,$0.67,Yes
https://www.amazon.com/s?k=EVOL&i=grocery&bbn=10329849011,"Sabra Singles Classic Guacamole, Great for On the Go Snacks and Lunches, 2 Oz Mini Cup (Pack of 4)",4.6,"6,140",,$4.99,$0.62,Yes
https://www.amazon.com/s?k=EVOL&i=grocery&bbn=10329849011,"Deep Indian Kitchen, Chicken Curry Rice, 9oz (Frozen)",4.3,512,,$6.69,$0.74,Yes
https://www.amazon.com/s?k=Hot+Pockets&i=grocery&bbn=10329849011,"Welch's Fruit Snacks, Mixed Fruit, Gluten Free, Bulk Pack, 0.9 oz Individual Single Serve Bags 40 Count (Pack of 1)",4.8,"92,980",,$10.29,$0.26,Yes
https://www.amazon.com/s?k=Hot+Pockets&i=grocery&bbn=10329849011,"Tyson Fully Cooked Southern Style Chicken Tenders, 25 oz. (Frozen)",4.6,"10,585",$11.99,$11.29,$7.23,Yes
https://www.amazon.com/s?k=Hot+Pockets&i=grocery&bbn=10329849011,"Tyson Fully Cooked Honey Battered Chicken Breast Tenders, 25.5 Oz (Frozen)",4.4,"5,463",$8.79,$7.69,$4.83,Yes
https://www.amazon.com/s?k=Hot+Pockets&i=grocery&bbn=10329849011,"Capri Sun Pacific Cooler Mixed Fruit Flavored Juice Drink Blend, 10 ct Box, 6 fl oz Pouches",4.8,"31,208",,$4.19,$0.07,Yes
https://www.amazon.com/s?k=Hot+Pockets&i=grocery&bbn=10329849011,"Jimmy Dean Meat Lovers Breakfast Bowl, Single Serve (Frozen)",4.6,"5,174",,$3.39,$0.48,Yes
https://www.amazon.com/s?k=Hot+Pockets&i=grocery&bbn=10329849011,"Tyson Fully Cooked Chicken Nuggets, Frozen Chicken Nuggets, 2 lb",4.7,"15,128",,$7.69,$3.85,Yes
https://www.amazon.com/s?k=Hot+Pockets&i=grocery&bbn=10329849011,"Jose Ole Flour Taquitos, Beef & Cheese, 22.5 Ounce, Frozen",4.5,"3,004",,$7.49,$0.33,Yes
https://www.amazon.com/s?k=Hot+Pockets&i=grocery&bbn=10329849011,"Banquet Frozen Pot Pie Dinner, Chicken, 7 oz",4.5,"4,575",,$1.49,$0.21,Yes
https://www.amazon.com/s?k=Hot+Pockets&i=grocery&bbn=10329849011,"Swiss Miss Indulgent Collection White Chocolate Flavored Hot Drink Mix, 1.38 oz 8 ct, 11.04 oz",4.6,"25,106",,$3.59,$0.33,Yes
https://www.amazon.com/s?k=Hot+Pockets&i=grocery&bbn=10329849011,"Cheez-It Cheese Crackers, Baked Snack Crackers, Office and Kids Snacks, Original, 7oz Box (1 Box)",4.7,"2,641",$3.99,$3.49,$0.50,Yes
https://www.amazon.com/s?k=Hot+Pockets&i=grocery&bbn=10329849011,"Banquet Frozen Pot Pie Dinner,Turkey, 7 oz",4.4,"4,621",,$1.49,$0.21,Yes
https://www.amazon.com/s?k=Hot+Pockets&i=grocery&bbn=10329849011,"Pop-Tarts Toaster Pastries, Breakfast Foods, Kids Snacks, Frosted Strawberry, 13.5oz Box (8 Pop-Tarts)",4.7,"8,135",,$3.79,$0.28,Yes
https://www.amazon.com/s?k=Hot+Pockets&i=grocery&bbn=10329849011,"Totino's Pizza Rolls, Pepperoni, 50 ct, 24.8 oz (frozen)",4.7,"3,246",,$6.79,$0.27,Yes
https://www.amazon.com/s?k=Hot+Pockets&i=grocery&bbn=10329849011,"Bagel Bites Bagel Dogs with Oscar Mayer Frozen Snacks, 12 ct Box",4.5,"4,298",,$6.79,$0.57,Yes
https://www.amazon.com/s?k=Hot+Pockets&i=grocery&bbn=10329849011,"Tyson Fully Cooked Fun Dinosaur Chicken Nuggets, 29 oz (Frozen)",4.7,"8,074",$8.79,$7.69,$4.24,Yes
https://www.amazon.com/s?k=Hot+Pockets&i=grocery&bbn=10329849011,Jimmy Dean Blueberry Pancakes And Sausage On A Stick Frozen Breakfast 12 Count,4.7,"3,493",,$10.29,$0.34,Yes
https://www.amazon.com/s?k=Hot+Pockets&i=grocery&bbn=10329849011,"Zatarain's Bourbon Chicken Pasta (Frozen Meal), 10.5 oz",4.2,229,,$4.09,$0.39,Yes
https://www.amazon.com/s?k=Hot+Pockets&i=grocery&bbn=10329849011,"Minute Maid, Berry Punch Juice Drink, 59 oz",4.8,"15,402",,$1.99,$0.03,Yes
https://www.amazon.com/s?k=Hot+Pockets&i=grocery&bbn=10329849011,Stouffer's Lasagna with Meat Sauce Frozen Meal,4.6,"3,491",$5.99,$5.39,$0.28,Yes
https://www.amazon.com/s?k=Hot+Pockets&i=grocery&bbn=10329849011,"Post Fruity Pebbles, 15 Ounce",4.8,"5,274",,$4.69,$0.31,Yes
https://www.amazon.com/s?k=Hot+Pockets&i=grocery&bbn=10329849011,"Original Cinnamon Toast Crunch Breakfast Cereal, Crispy Cinnamon Cereal, 16.8 oz. Large Size Box",4.8,"12,006",,$6.99,$0.42,Yes
https://www.amazon.com/s?k=Hot+Pockets&i=grocery&bbn=10329849011,Velveeta Original Microwavable Shells & Cheese Cups 8-2.39 oz cups,4.7,"31,974",,$11.29,$0.59,Yes
https://www.amazon.com/s?k=Hot+Pockets&i=grocery&bbn=10329849011,"Totino's Pizza Rolls, Combination, Frozen Snacks, 24.8 oz, 50 ct",4.6,"2,524",,$6.79,$0.27,Yes
https://www.amazon.com/s?k=Hot+Pockets&i=grocery&bbn=10329849011,"Annie's Three Cheese Mini Frozen Pizza Bagels, 6.65 oz, 9 ct",4.3,"5,243",,$7.69,$1.16,Yes
https://www.amazon.com/s?k=Life+Cuisine&i=grocery&bbn=10329849011,Lean Cuisine Favorites Glazed Turkey Tenderloins Frozen Meal,4.4,959,,$3.99,$0.44,Yes
